<?xml version="1.0" encoding="UTF-8"?>
<RegistoUrgencia 
    xmlns:xsi="http://www.w3.org/2001/XMLSchema-instance"
    xsi:noNamespaceSchemaLocation="urgencia.xsd">
    
    <Cabecalho>
        <HospitalID>HOSP_001</HospitalID>

        <RegistoID>URG_HOSP_001_12345</RegistoID> 

        <MoradaHospital>Avenida Professor Egas Moniz, Lisboa</MoradaHospital> 
        
        <HorarioRegisto>2025-11-20T17:45:00Z</HorarioRegisto> 
    </Cabecalho>
    
    <Tipologia>pediatrica</Tipologia>
    
    <Estado>Aberta</Estado>
    
    <UtentesEspera>
        <NaoUrgente>15</NaoUrgente>
        <PoucoUrgente>8</PoucoUrgente>
        <Urgente>3</Urgente>
        <MuitoUrgente>1</MuitoUrgente>
    </UtentesEspera>
    
    <UtentesObservacao>
        <NaoUrgente>22</NaoUrgente>
        <PoucoUrgente>14</PoucoUrgente>
        <Urgente>7</Urgente>
        <MuitoUrgente>2</MuitoUrgente>
    </UtentesObservacao>
    
</RegistoUrgencia>